[{"id":"us-abc-main","channelId":"us-abc","name":"Main","isMain":true,"broadcastAreas":["c/US"],"timezones":["America/New_York"],"languages":["eng"],"format":null,"epgIds":[],"enabled":true},{"id":"us-cbs-main","channelId":"us-cbs","name":"Main","isMain":true,"broadcastAreas":["c/US"],"timezones":["America/New_York"],"languages":["eng"],"format":null,"epgIds":[],"enabled":true},{"id":"us-nbc-main","channelId":"us-nbc","name":"Main","isMain":true,"broadcastAreas":["c/US"],"timezones":["America/New_York"],"languages":["eng"],"format":null,"epgIds":[],"enabled":true},{"id":"us-fox-main","channelId":"us-fox","name":"Main","isMain":true,"broadcastAreas":["c/US"],"timezones":["America/New_York"],"languages":["eng"],"format":null,"epgIds":[],"enabled":true},{"id":"us-pbs-main","channelId":"us-pbs","name":"Main","isMain":true,"broadcastAreas":["c/US"],"timezones":["America/New_York"],"languages":["eng"],"format":null,"epgIds":[],"enabled":true},{"id":"us-cnn-main","channelId":"us-cnn","name":"Main","isMain":true,"broadcastAreas":["c/US"],"timezones":["America/New_York"],"languages":["eng"],"format":null,"epgIds":[],"enabled":true},{"id":"us-ms-now-main","channelId":"us-ms-now","name":"Main","isMain":true,"broadcastAreas":["c/US"],"timezones":["America/New_York"],"languages":["eng"],"format":null,"epgIds":[],"enabled":true},{"id":"us-fox-news-main","channelId":"us-fox-news","name":"Main","isMain":true,"broadcastAreas":["c/US"],"timezones":["America/New_York"],"languages":["eng"],"format":null,"epgIds":[],"enabled":true},{"id":"us-cnbc-main","channelId":"us-cnbc","name":"Main","isMain":true,"broadcastAreas":["c/US"],"timezones":["America/New_York"],"languages":["eng"],"format":null,"epgIds":[],"enabled":true},{"id":"us-bloomberg-tv-main","channelId":"us-bloomberg-tv","name":"Main","isMain":true,"broadcastAreas":["c/US"],"timezones":["America/New_York"],"languages":["eng"],"format":null,"epgIds":[],"enabled":true},{"id":"us-pbs-kids-main","channelId":"us-pbs-kids","name":"Main","isMain":true,"broadcastAreas":["c/US"],"timezones":["America/New_York"],"languages":["eng"],"format":null,"epgIds":[],"enabled":true}]
