[{"id":"tr-trt-1-main","channelId":"tr-trt-1","name":"Main","isMain":true,"broadcastAreas":["c/TR"],"timezones":["Europe/Istanbul"],"languages":["tur"],"format":null,"epgIds":[],"enabled":true},{"id":"tr-atv-main","channelId":"tr-atv","name":"Main","isMain":true,"broadcastAreas":["c/TR"],"timezones":["Europe/Istanbul"],"languages":["tur"],"format":null,"epgIds":[],"enabled":true},{"id":"tr-kanal-d-main","channelId":"tr-kanal-d","name":"Main","isMain":true,"broadcastAreas":["c/TR"],"timezones":["Europe/Istanbul"],"languages":["tur"],"format":null,"epgIds":[],"enabled":true},{"id":"tr-show-tv-main","channelId":"tr-show-tv","name":"Main","isMain":true,"broadcastAreas":["c/TR"],"timezones":["Europe/Istanbul"],"languages":["tur"],"format":null,"epgIds":[],"enabled":true},{"id":"tr-star-tv-main","channelId":"tr-star-tv","name":"Main","isMain":true,"broadcastAreas":["c/TR"],"timezones":["Europe/Istanbul"],"languages":["tur"],"format":null,"epgIds":[],"enabled":true},{"id":"tr-now-main","channelId":"tr-now","name":"Main","isMain":true,"broadcastAreas":["c/TR"],"timezones":["Europe/Istanbul"],"languages":["tur"],"format":null,"epgIds":[],"enabled":true},{"id":"tr-tv8-main","channelId":"tr-tv8","name":"Main","isMain":true,"broadcastAreas":["c/TR"],"timezones":["Europe/Istanbul"],"languages":["tur"],"format":null,"epgIds":[],"enabled":true},{"id":"tr-trt-haber-main","channelId":"tr-trt-haber","name":"Main","isMain":true,"broadcastAreas":["c/TR"],"timezones":["Europe/Istanbul"],"languages":["tur"],"format":null,"epgIds":[],"enabled":true},{"id":"tr-ntv-main","channelId":"tr-ntv","name":"Main","isMain":true,"broadcastAreas":["c/TR"],"timezones":["Europe/Istanbul"],"languages":["tur"],"format":null,"epgIds":[],"enabled":true},{"id":"tr-cnn-turk-main","channelId":"tr-cnn-turk","name":"Main","isMain":true,"broadcastAreas":["c/TR"],"timezones":["Europe/Istanbul"],"languages":["tur"],"format":null,"epgIds":[],"enabled":true},{"id":"tr-haberturk-main","channelId":"tr-haberturk","name":"Main","isMain":true,"broadcastAreas":["c/TR"],"timezones":["Europe/Istanbul"],"languages":["tur"],"format":null,"epgIds":[],"enabled":true},{"id":"tr-a-haber-main","channelId":"tr-a-haber","name":"Main","isMain":true,"broadcastAreas":["c/TR"],"timezones":["Europe/Istanbul"],"languages":["tur"],"format":null,"epgIds":[],"enabled":true},{"id":"tr-trt-spor-main","channelId":"tr-trt-spor","name":"Main","isMain":true,"broadcastAreas":["c/TR"],"timezones":["Europe/Istanbul"],"languages":["tur"],"format":null,"epgIds":[],"enabled":true},{"id":"tr-trt-cocuk-main","channelId":"tr-trt-cocuk","name":"Main","isMain":true,"broadcastAreas":["c/TR"],"timezones":["Europe/Istanbul"],"languages":["tur"],"format":null,"epgIds":[],"enabled":true},{"id":"tr-kanal-7-main","channelId":"tr-kanal-7","name":"Main","isMain":true,"broadcastAreas":["c/TR"],"timezones":["Europe/Istanbul"],"languages":["tur"],"format":null,"epgIds":[],"enabled":true}]
